[
  {
    "id": 847,
    "name": "Wonderville Open Hive Night 1/7/2026",
    "scene": 15,
    "scene_name": "nyc",
    "slug": "wonderville-open-hive-night-172026",
    "date": "2026-01-07",
    "is_active": false,
    "location": "",
    "description": "",
    "allow_registration": false,
    "registration_close_date": null,
    "registration_banner": null,
    "accept_payments": false,
    "link_type": "hivemind",
    "registration_message": "",
    "payment_message": "",
    "stripe_configured": false,
    "awards": null,
    "require_player_photo": false,
    "assigned_cabinets": [
      29
    ],
    "tidbit_prompt": "Interesting tidbit about yourself",
    "scene_display_name": "New York"
  },
  {
    "id": 842,
    "name": "January 2026 BYOT",
    "scene": 15,
    "scene_name": "nyc",
    "slug": "january-2026-byot",
    "date": "2026-01-03",
    "is_active": false,
    "location": "",
    "description": "",
    "allow_registration": false,
    "registration_close_date": null,
    "registration_banner": null,
    "accept_payments": false,
    "link_type": "hivemind",
    "registration_message": "",
    "payment_message": "",
    "stripe_configured": false,
    "awards": null,
    "require_player_photo": false,
    "assigned_cabinets": [],
    "tidbit_prompt": "Interesting tidbit about yourself",
    "scene_display_name": "New York"
  },
  {
    "id": 835,
    "name": "Wonderville Open Hive Night 12/17/2025",
    "scene": 15,
    "scene_name": "nyc",
    "slug": "wonderville-open-hive-night-12172025",
    "date": "2025-12-17",
    "is_active": false,
    "location": "",
    "description": "",
    "allow_registration": false,
    "registration_close_date": null,
    "registration_banner": null,
    "accept_payments": false,
    "link_type": "hivemind",
    "registration_message": "",
    "payment_message": "",
    "stripe_configured": false,
    "awards": null,
    "require_player_photo": false,
    "assigned_cabinets": [],
    "tidbit_prompt": "Interesting tidbit about yourself",
    "scene_display_name": "New York"
  },
  {
    "id": 832,
    "name": "Wonderville Open Hive Night 12/10/2025",
    "scene": 15,
    "scene_name": "nyc",
    "slug": "wonderville-open-hive-night-12102025",
    "date": "2025-12-10",
    "is_active": false,
    "location": "",
    "description": "",
    "allow_registration": false,
    "registration_close_date": null,
    "registration_banner": null,
    "accept_payments": false,
    "link_type": "hivemind",
    "registration_message": "",
    "payment_message": "",
    "stripe_configured": false,
    "awards": null,
    "require_player_photo": false,
    "assigned_cabinets": [],
    "tidbit_prompt": "Interesting tidbit about yourself",
    "scene_display_name": "New York"
  },
  {
    "id": 825,
    "name": "NYC Mid-Atlantic Circuit 2025",
    "scene": 15,
    "scene_name": "nyc",
    "slug": "nyc-mid-atlantic-circuit-2025",
    "date": "2025-12-06",
    "is_active": false,
    "location": "",
    "description": "New York City's first edition of the Mid-Atlantic Circuit! Come enjoy the city during the holidays and play at a new space hosted by NYC Resistor!",
    "allow_registration": true,
    "registration_close_date": "2025-12-06",
    "registration_banner": null,
    "accept_payments": true,
    "link_type": "hivemind",
    "registration_message": "## \ud83d\udea8 PLEASE READ THESE NOTES FIRST \ud83d\udea8\n> \ud83d\udcdd You can change your information at any time while registration is open.\n\n> \ud83d\udcb8 We are asking anyone who is able to please contribute ANY AMOUNT to the community support fund. It will be spread equitably across all players who need assistance. Just enter an amount in addition to your ticket at the bottom of this form \n\n> \u2764\ufe0f If you need help with your ticket, just fill out the form and click save info instead of going through payment. We will follow up with you later if any money is due.\n\n> \ud83d\udc40 Spectators will not be charged entry but do need to register so you can be included on the attendee list as NYC Resistor is a private space. Fill out the form including the spectator checkbox below and click save info instead of going through payment.\n\n> \ud83e\uddd1\u200d\ud83e\udd1d\u200d\ud83e\uddd1 If your team's name is not finalized, select Free Agent and return later to create your team. Be sure to check if your team already exists before creating a new one.\n\n> \ud83e\uddfe We are using Stripe to accept payments. Stripe securely stores your personal data and it will not be used or shared with anyone other than to process the payment.\n\n### If you have any questions, please reach out to Tyler (tyler13) or Alex (bacongames) on Discord!",
    "payment_message": "To cover venue and cabinet logistics costs, we are asking attendees to pay a registration fee of $20.",
    "stripe_configured": true,
    "awards": null,
    "require_player_photo": false,
    "assigned_cabinets": [
      138,
      139
    ],
    "tidbit_prompt": "Interesting tidbit about yourself",
    "scene_display_name": "New York"
  },
  {
    "id": 829,
    "name": "Wonderville Open Hive Night 12/3/2025",
    "scene": 15,
    "scene_name": "nyc",
    "slug": "wonderville-open-hive-night-1232025",
    "date": "2025-12-03",
    "is_active": false,
    "location": "",
    "description": "",
    "allow_registration": false,
    "registration_close_date": null,
    "registration_banner": null,
    "accept_payments": false,
    "link_type": "hivemind",
    "registration_message": "",
    "payment_message": "",
    "stripe_configured": false,
    "awards": null,
    "require_player_photo": false,
    "assigned_cabinets": [],
    "tidbit_prompt": "Interesting tidbit about yourself",
    "scene_display_name": "New York"
  },
  {
    "id": 827,
    "name": "Wonderville Open Hive Night 11/26/2025",
    "scene": 15,
    "scene_name": "nyc",
    "slug": "wonderville-open-hive-night-11262025",
    "date": "2025-11-26",
    "is_active": false,
    "location": "",
    "description": "",
    "allow_registration": false,
    "registration_close_date": null,
    "registration_banner": null,
    "accept_payments": false,
    "link_type": "hivemind",
    "registration_message": "",
    "payment_message": "",
    "stripe_configured": false,
    "awards": null,
    "require_player_photo": false,
    "assigned_cabinets": [],
    "tidbit_prompt": "Interesting tidbit about yourself",
    "scene_display_name": "New York"
  },
  {
    "id": 822,
    "name": "Wonderville Open Hive Night 11/19/2025",
    "scene": 15,
    "scene_name": "nyc",
    "slug": "kqohn20251119",
    "date": "2025-11-19",
    "is_active": false,
    "location": "",
    "description": "",
    "allow_registration": false,
    "registration_close_date": null,
    "registration_banner": null,
    "accept_payments": false,
    "link_type": "hivemind",
    "registration_message": "",
    "payment_message": "",
    "stripe_configured": false,
    "awards": null,
    "require_player_photo": false,
    "assigned_cabinets": [],
    "tidbit_prompt": "Interesting tidbit about yourself",
    "scene_display_name": "New York"
  },
  {
    "id": 818,
    "name": "Wonderville Open Hive Night 11/12/2025",
    "scene": 15,
    "scene_name": "nyc",
    "slug": "kqohn20251112",
    "date": "2025-11-12",
    "is_active": false,
    "location": "",
    "description": "",
    "allow_registration": false,
    "registration_close_date": null,
    "registration_banner": null,
    "accept_payments": false,
    "link_type": "hivemind",
    "registration_message": "",
    "payment_message": "",
    "stripe_configured": false,
    "awards": null,
    "require_player_photo": false,
    "assigned_cabinets": [],
    "tidbit_prompt": "Interesting tidbit about yourself",
    "scene_display_name": "New York"
  },
  {
    "id": 813,
    "name": "Wonderville Open Hive Night 11/5/2025",
    "scene": 15,
    "scene_name": "nyc",
    "slug": "kqohn20251105",
    "date": "2025-11-05",
    "is_active": false,
    "location": "",
    "description": "",
    "allow_registration": false,
    "registration_close_date": null,
    "registration_banner": null,
    "accept_payments": false,
    "link_type": "hivemind",
    "registration_message": "",
    "payment_message": "",
    "stripe_configured": false,
    "awards": null,
    "require_player_photo": false,
    "assigned_cabinets": [],
    "tidbit_prompt": "Interesting tidbit about yourself",
    "scene_display_name": "New York"
  },
  {
    "id": 811,
    "name": "Wonderville November 2025 BYOT",
    "scene": 15,
    "scene_name": "nyc",
    "slug": "byot2025111",
    "date": "2025-11-01",
    "is_active": false,
    "location": "",
    "description": "",
    "allow_registration": false,
    "registration_close_date": null,
    "registration_banner": null,
    "accept_payments": false,
    "link_type": "hivemind",
    "registration_message": "",
    "payment_message": "",
    "stripe_configured": false,
    "awards": null,
    "require_player_photo": false,
    "assigned_cabinets": [],
    "tidbit_prompt": "Interesting tidbit about yourself",
    "scene_display_name": "New York"
  },
  {
    "id": 807,
    "name": "Wonderville Open Hive Night 10/29/2025",
    "scene": 15,
    "scene_name": "nyc",
    "slug": "kqohn20251029",
    "date": "2025-10-29",
    "is_active": false,
    "location": "",
    "description": "",
    "allow_registration": false,
    "registration_close_date": null,
    "registration_banner": null,
    "accept_payments": false,
    "link_type": "hivemind",
    "registration_message": "",
    "payment_message": "",
    "stripe_configured": false,
    "awards": null,
    "require_player_photo": false,
    "assigned_cabinets": [],
    "tidbit_prompt": "Interesting tidbit about yourself",
    "scene_display_name": "New York"
  },
  {
    "id": 803,
    "name": "Wonderville Open Hive Night 10/22/2025",
    "scene": 15,
    "scene_name": "nyc",
    "slug": "kqohn20251022",
    "date": "2025-10-22",
    "is_active": false,
    "location": "",
    "description": "",
    "allow_registration": false,
    "registration_close_date": null,
    "registration_banner": null,
    "accept_payments": false,
    "link_type": "hivemind",
    "registration_message": "",
    "payment_message": "",
    "stripe_configured": false,
    "awards": null,
    "require_player_photo": false,
    "assigned_cabinets": [],
    "tidbit_prompt": "Interesting tidbit about yourself",
    "scene_display_name": "New York"
  },
  {
    "id": 800,
    "name": "Wonderville Open Hive Night 10/15/2025",
    "scene": 15,
    "scene_name": "nyc",
    "slug": "kqohn20251015",
    "date": "2025-10-15",
    "is_active": false,
    "location": "",
    "description": "",
    "allow_registration": false,
    "registration_close_date": null,
    "registration_banner": null,
    "accept_payments": false,
    "link_type": "hivemind",
    "registration_message": "",
    "payment_message": "",
    "stripe_configured": false,
    "awards": null,
    "require_player_photo": false,
    "assigned_cabinets": [],
    "tidbit_prompt": "Interesting tidbit about yourself",
    "scene_display_name": "New York"
  },
  {
    "id": 795,
    "name": "Wonderville Open Hive Night 10/8/2025",
    "scene": 15,
    "scene_name": "nyc",
    "slug": "wonderville-open-hive-night-1082025",
    "date": "2025-10-08",
    "is_active": false,
    "location": "",
    "description": "",
    "allow_registration": false,
    "registration_close_date": null,
    "registration_banner": null,
    "accept_payments": false,
    "link_type": "hivemind",
    "registration_message": "",
    "payment_message": "",
    "stripe_configured": false,
    "awards": null,
    "require_player_photo": false,
    "assigned_cabinets": [],
    "tidbit_prompt": "Interesting tidbit about yourself",
    "scene_display_name": "New York"
  },
  {
    "id": 793,
    "name": "Wonderville October 2025 BYOT",
    "scene": 15,
    "scene_name": "nyc",
    "slug": "wonderville-october-2025-byot",
    "date": "2025-10-04",
    "is_active": false,
    "location": "",
    "description": "",
    "allow_registration": false,
    "registration_close_date": null,
    "registration_banner": null,
    "accept_payments": false,
    "link_type": "hivemind",
    "registration_message": "",
    "payment_message": "",
    "stripe_configured": false,
    "awards": null,
    "require_player_photo": false,
    "assigned_cabinets": [],
    "tidbit_prompt": "Interesting tidbit about yourself",
    "scene_display_name": "New York"
  },
  {
    "id": 791,
    "name": "Wonderville Open Hive Night 10/1/2025",
    "scene": 15,
    "scene_name": "nyc",
    "slug": "kqohn20251001",
    "date": "2025-10-01",
    "is_active": false,
    "location": "",
    "description": "",
    "allow_registration": false,
    "registration_close_date": null,
    "registration_banner": null,
    "accept_payments": false,
    "link_type": "hivemind",
    "registration_message": "",
    "payment_message": "",
    "stripe_configured": false,
    "awards": null,
    "require_player_photo": false,
    "assigned_cabinets": [],
    "tidbit_prompt": "Interesting tidbit about yourself",
    "scene_display_name": "New York"
  },
  {
    "id": 787,
    "name": "Wonderville Open Hive Night 09/24/2025",
    "scene": 15,
    "scene_name": "nyc",
    "slug": "kqohn20250924",
    "date": "2025-09-24",
    "is_active": false,
    "location": "",
    "description": "",
    "allow_registration": false,
    "registration_close_date": null,
    "registration_banner": null,
    "accept_payments": false,
    "link_type": "hivemind",
    "registration_message": "",
    "payment_message": "",
    "stripe_configured": false,
    "awards": null,
    "require_player_photo": false,
    "assigned_cabinets": [],
    "tidbit_prompt": "Interesting tidbit about yourself",
    "scene_display_name": "New York"
  },
  {
    "id": 776,
    "name": "Wonderville Open Hive Night 09/17/2025",
    "scene": 15,
    "scene_name": "nyc",
    "slug": "kqohn20250917",
    "date": "2025-09-17",
    "is_active": false,
    "location": "",
    "description": "",
    "allow_registration": false,
    "registration_close_date": null,
    "registration_banner": null,
    "accept_payments": false,
    "link_type": "hivemind",
    "registration_message": "",
    "payment_message": "",
    "stripe_configured": false,
    "awards": null,
    "require_player_photo": false,
    "assigned_cabinets": [],
    "tidbit_prompt": "Interesting tidbit about yourself",
    "scene_display_name": "New York"
  },
  {
    "id": 774,
    "name": "Wonderville Open Hive Night 09/10/2025",
    "scene": 15,
    "scene_name": "nyc",
    "slug": "kqohn20250910j",
    "date": "2025-09-10",
    "is_active": false,
    "location": "",
    "description": "",
    "allow_registration": false,
    "registration_close_date": null,
    "registration_banner": null,
    "accept_payments": false,
    "link_type": "hivemind",
    "registration_message": "",
    "payment_message": "",
    "stripe_configured": false,
    "awards": null,
    "require_player_photo": false,
    "assigned_cabinets": [],
    "tidbit_prompt": "Interesting tidbit about yourself",
    "scene_display_name": "New York"
  },
  {
    "id": 772,
    "name": "Wonderville September 2025 BYOT",
    "scene": 15,
    "scene_name": "nyc",
    "slug": "BYOT20250906",
    "date": "2025-09-06",
    "is_active": false,
    "location": "",
    "description": "",
    "allow_registration": false,
    "registration_close_date": null,
    "registration_banner": null,
    "accept_payments": false,
    "link_type": "hivemind",
    "registration_message": "",
    "payment_message": "",
    "stripe_configured": false,
    "awards": null,
    "require_player_photo": false,
    "assigned_cabinets": [],
    "tidbit_prompt": "Interesting tidbit about yourself",
    "scene_display_name": "New York"
  },
  {
    "id": 768,
    "name": "Wonderville Open Hive Night 09/03/2025",
    "scene": 15,
    "scene_name": "nyc",
    "slug": "kqohn20250903",
    "date": "2025-09-03",
    "is_active": false,
    "location": "",
    "description": "",
    "allow_registration": false,
    "registration_close_date": null,
    "registration_banner": null,
    "accept_payments": false,
    "link_type": "hivemind",
    "registration_message": "",
    "payment_message": "",
    "stripe_configured": false,
    "awards": null,
    "require_player_photo": false,
    "assigned_cabinets": [],
    "tidbit_prompt": "Interesting tidbit about yourself",
    "scene_display_name": "New York"
  },
  {
    "id": 764,
    "name": "Wonderville Open Hive Night 08/27/2025",
    "scene": 15,
    "scene_name": "nyc",
    "slug": "kqohn20250827",
    "date": "2025-08-27",
    "is_active": false,
    "location": "",
    "description": "",
    "allow_registration": false,
    "registration_close_date": null,
    "registration_banner": null,
    "accept_payments": false,
    "link_type": "hivemind",
    "registration_message": "",
    "payment_message": "",
    "stripe_configured": false,
    "awards": null,
    "require_player_photo": false,
    "assigned_cabinets": [],
    "tidbit_prompt": "Interesting tidbit about yourself",
    "scene_display_name": "New York"
  },
  {
    "id": 758,
    "name": "Wonderville Open Hive Night 08/20/2025",
    "scene": 15,
    "scene_name": "nyc",
    "slug": "kqohn20250820",
    "date": "2025-08-20",
    "is_active": false,
    "location": "",
    "description": "",
    "allow_registration": false,
    "registration_close_date": null,
    "registration_banner": null,
    "accept_payments": false,
    "link_type": "hivemind",
    "registration_message": "",
    "payment_message": "",
    "stripe_configured": false,
    "awards": null,
    "require_player_photo": false,
    "assigned_cabinets": [],
    "tidbit_prompt": "Interesting tidbit about yourself",
    "scene_display_name": "New York"
  },
  {
    "id": 754,
    "name": "Wonderville Open Hive Night 08/13/2025",
    "scene": 15,
    "scene_name": "nyc",
    "slug": "kqohn20250813",
    "date": "2025-08-13",
    "is_active": false,
    "location": "",
    "description": "",
    "allow_registration": false,
    "registration_close_date": null,
    "registration_banner": null,
    "accept_payments": false,
    "link_type": "hivemind",
    "registration_message": "",
    "payment_message": "",
    "stripe_configured": false,
    "awards": null,
    "require_player_photo": false,
    "assigned_cabinets": [],
    "tidbit_prompt": "Interesting tidbit about yourself",
    "scene_display_name": "New York"
  },
  {
    "id": 734,
    "name": "Brooklyn Coronation 2025: A Gilded Jubilee",
    "scene": 15,
    "scene_name": "nyc",
    "slug": "coronation-2025",
    "date": "2025-08-09",
    "is_active": false,
    "location": "",
    "description": "Please join us as we celebrate the 10th anniversary of The Brooklyn Coronation! Tournament Festivities will be held on August 9-10, 2025 at the NYU Game Center in downtown Brooklyn. Enjoy the feasts of Chinatown with Richard! Experience endless activities in our beautiful metropolis. 4 cabs\n\nhttps://linktr.ee/coronation2025",
    "allow_registration": true,
    "registration_close_date": "2025-08-01",
    "registration_banner": "https://cdn.kqhivemind.com/prod/tournament/registration-banners/4c42c9b8-1924-4f60-96de-2b414c4135d0.png",
    "accept_payments": true,
    "link_type": "hivemind",
    "registration_message": "## \ud83d\udea8 PLEASE READ THESE NOTES FIRST \ud83d\udea8\n> \ud83d\udcdd You can change your information at any time while registration is open.\n\n> \u2705 We are collecting first & last names (preferred names encouraged) for badges to enter the NYU facility only. They will not be used elsewhere.\n\n> \ud83d\udcf7 Please provide a picture with your face clearly visible, we will need to include these on your badges for ease of access to the NYU facility.\n\n> \ud83d\udcb8 We are asking anyone who is able to please contribute ANY AMOUNT to the community support fund. It will be spread equitably across all players who need assistance. Just enter an amount in addition to your ticket at the bottom of this form \n\n> \u2764\ufe0f If you need help with your ticket, just fill out the form and click save info instead of going through payment. We will follow up with you later if any money is due.\n\n> \ud83d\udc40 Spectators will not be charged entry but do need to register and receive a lanyard for entry to the NYU facility; fill out the form including the spectator checkbox below and click save info instead of going through payment. \n\n> \ud83e\uddd1\u200d\ud83e\udd1d\u200d\ud83e\uddd1 If your team's name is not finalized, select Free Agent and return later to create your team. Be sure to check if your team already exists before creating a new one.\n\n> \ud83e\uddfe We are using Stripe to accept payments. Stripe securely stores your personal data and it will not be used or shared with anyone other than to process the payment.\n\n### If you have any questions, please reach out to Tyler (tyler13) or Alex (bacongames) on Discord! \n\n# We can't wait to see you in Brooklyn!",
    "payment_message": "Entry to KQNYC's The Brooklyn Coronation 2024 is $40. We understand some may need financial assistance and have provided an option for those with the ability to to donate a tournament entry amount, as well as an option to chose the amount you donate to the Community Support Fund.",
    "stripe_configured": true,
    "awards": null,
    "require_player_photo": false,
    "assigned_cabinets": [
      97
    ],
    "tidbit_prompt": "Interesting tidbit about yourself",
    "scene_display_name": "New York"
  },
  {
    "id": 750,
    "name": "Wonderville Open Hive Night 08/06/2025",
    "scene": 15,
    "scene_name": "nyc",
    "slug": "kqohn20250806",
    "date": "2025-08-06",
    "is_active": false,
    "location": "",
    "description": "",
    "allow_registration": false,
    "registration_close_date": null,
    "registration_banner": null,
    "accept_payments": false,
    "link_type": "hivemind",
    "registration_message": "",
    "payment_message": "",
    "stripe_configured": false,
    "awards": null,
    "require_player_photo": false,
    "assigned_cabinets": [],
    "tidbit_prompt": "Interesting tidbit about yourself",
    "scene_display_name": "New York"
  },
  {
    "id": 745,
    "name": "Wonderville Open Hive Night 07/30/2025",
    "scene": 15,
    "scene_name": "nyc",
    "slug": "kqohn20250730",
    "date": "2025-07-30",
    "is_active": false,
    "location": "",
    "description": "",
    "allow_registration": false,
    "registration_close_date": null,
    "registration_banner": null,
    "accept_payments": false,
    "link_type": "hivemind",
    "registration_message": "",
    "payment_message": "",
    "stripe_configured": false,
    "awards": null,
    "require_player_photo": false,
    "assigned_cabinets": [],
    "tidbit_prompt": "Interesting tidbit about yourself",
    "scene_display_name": "New York"
  },
  {
    "id": 739,
    "name": "Wonderville Open Hive Night 07/23/2025",
    "scene": 15,
    "scene_name": "nyc",
    "slug": "kqohn20250723",
    "date": "2025-07-23",
    "is_active": false,
    "location": "",
    "description": "",
    "allow_registration": false,
    "registration_close_date": null,
    "registration_banner": null,
    "accept_payments": false,
    "link_type": "hivemind",
    "registration_message": "",
    "payment_message": "",
    "stripe_configured": false,
    "awards": null,
    "require_player_photo": false,
    "assigned_cabinets": [],
    "tidbit_prompt": "Interesting tidbit about yourself",
    "scene_display_name": "New York"
  },
  {
    "id": 729,
    "name": "Wonderville Open Hive Night 07/16/2025",
    "scene": 15,
    "scene_name": "nyc",
    "slug": "kqohn20250716",
    "date": "2025-07-16",
    "is_active": false,
    "location": "",
    "description": "",
    "allow_registration": false,
    "registration_close_date": null,
    "registration_banner": null,
    "accept_payments": false,
    "link_type": "hivemind",
    "registration_message": "",
    "payment_message": "",
    "stripe_configured": false,
    "awards": null,
    "require_player_photo": false,
    "assigned_cabinets": [],
    "tidbit_prompt": "Interesting tidbit about yourself",
    "scene_display_name": "New York"
  },
  {
    "id": 721,
    "name": "Wonderville Open Hive Night 07/09/2025",
    "scene": 15,
    "scene_name": "nyc",
    "slug": "kqohn20250709",
    "date": "2025-07-09",
    "is_active": false,
    "location": "",
    "description": "",
    "allow_registration": false,
    "registration_close_date": null,
    "registration_banner": null,
    "accept_payments": false,
    "link_type": "challonge",
    "registration_message": "",
    "payment_message": "",
    "stripe_configured": false,
    "awards": null,
    "require_player_photo": false,
    "assigned_cabinets": [],
    "tidbit_prompt": "Interesting tidbit about yourself",
    "scene_display_name": "New York"
  },
  {
    "id": 718,
    "name": "Wonderville July 2025 BYOT",
    "scene": 15,
    "scene_name": "nyc",
    "slug": "byot20250705",
    "date": "2025-07-05",
    "is_active": false,
    "location": "",
    "description": "",
    "allow_registration": false,
    "registration_close_date": null,
    "registration_banner": null,
    "accept_payments": false,
    "link_type": "challonge",
    "registration_message": "",
    "payment_message": "",
    "stripe_configured": false,
    "awards": null,
    "require_player_photo": false,
    "assigned_cabinets": [],
    "tidbit_prompt": "Interesting tidbit about yourself",
    "scene_display_name": "New York"
  },
  {
    "id": 717,
    "name": "Wonderville Open Hive Night 07/02/2025",
    "scene": 15,
    "scene_name": "nyc",
    "slug": "kqohn20250702",
    "date": "2025-07-02",
    "is_active": false,
    "location": "",
    "description": "",
    "allow_registration": false,
    "registration_close_date": null,
    "registration_banner": null,
    "accept_payments": false,
    "link_type": "challonge",
    "registration_message": "",
    "payment_message": "",
    "stripe_configured": false,
    "awards": null,
    "require_player_photo": false,
    "assigned_cabinets": [],
    "tidbit_prompt": "Interesting tidbit about yourself",
    "scene_display_name": "New York"
  },
  {
    "id": 712,
    "name": "Wonderville Open Hive Night 06/25/2025",
    "scene": 15,
    "scene_name": "nyc",
    "slug": "kqohn20250625",
    "date": "2025-06-25",
    "is_active": false,
    "location": "",
    "description": "",
    "allow_registration": false,
    "registration_close_date": null,
    "registration_banner": null,
    "accept_payments": false,
    "link_type": "challonge",
    "registration_message": "",
    "payment_message": "",
    "stripe_configured": false,
    "awards": null,
    "require_player_photo": false,
    "assigned_cabinets": [],
    "tidbit_prompt": "Interesting tidbit about yourself",
    "scene_display_name": "New York"
  },
  {
    "id": 706,
    "name": "Wonderville Open Hive Night 06/18/2025",
    "scene": 15,
    "scene_name": "nyc",
    "slug": "kqohn20250618",
    "date": "2025-06-18",
    "is_active": false,
    "location": "",
    "description": "",
    "allow_registration": false,
    "registration_close_date": null,
    "registration_banner": null,
    "accept_payments": false,
    "link_type": "challonge",
    "registration_message": "",
    "payment_message": "",
    "stripe_configured": false,
    "awards": null,
    "require_player_photo": false,
    "assigned_cabinets": [],
    "tidbit_prompt": "Interesting tidbit about yourself",
    "scene_display_name": "New York"
  },
  {
    "id": 701,
    "name": "Wonderville Open Hive Night 6/11/2025",
    "scene": 15,
    "scene_name": "nyc",
    "slug": "kqohn20250611",
    "date": "2025-06-11",
    "is_active": false,
    "location": "",
    "description": "",
    "allow_registration": false,
    "registration_close_date": null,
    "registration_banner": null,
    "accept_payments": false,
    "link_type": "challonge",
    "registration_message": "",
    "payment_message": "",
    "stripe_configured": false,
    "awards": null,
    "require_player_photo": false,
    "assigned_cabinets": [],
    "tidbit_prompt": "Interesting tidbit about yourself",
    "scene_display_name": "New York"
  },
  {
    "id": 698,
    "name": "Wonderville June 2025 BYOT",
    "scene": 15,
    "scene_name": "nyc",
    "slug": "BYOT20250607",
    "date": "2025-06-07",
    "is_active": false,
    "location": "",
    "description": "",
    "allow_registration": false,
    "registration_close_date": null,
    "registration_banner": null,
    "accept_payments": false,
    "link_type": "challonge",
    "registration_message": "",
    "payment_message": "",
    "stripe_configured": false,
    "awards": null,
    "require_player_photo": false,
    "assigned_cabinets": [],
    "tidbit_prompt": "Interesting tidbit about yourself",
    "scene_display_name": "New York"
  },
  {
    "id": 696,
    "name": "Wonderville Open Hive Night 06/04/2025",
    "scene": 15,
    "scene_name": "nyc",
    "slug": "kqohn20250604",
    "date": "2025-06-04",
    "is_active": false,
    "location": "",
    "description": "",
    "allow_registration": false,
    "registration_close_date": null,
    "registration_banner": null,
    "accept_payments": false,
    "link_type": "challonge",
    "registration_message": "",
    "payment_message": "",
    "stripe_configured": false,
    "awards": null,
    "require_player_photo": false,
    "assigned_cabinets": [],
    "tidbit_prompt": "Interesting tidbit about yourself",
    "scene_display_name": "New York"
  },
  {
    "id": 687,
    "name": "Wonderville Open Hive Night 05/28/2024",
    "scene": 15,
    "scene_name": "nyc",
    "slug": "kqohn20250528",
    "date": "2025-05-28",
    "is_active": false,
    "location": "",
    "description": "",
    "allow_registration": false,
    "registration_close_date": null,
    "registration_banner": null,
    "accept_payments": false,
    "link_type": "challonge",
    "registration_message": "",
    "payment_message": "",
    "stripe_configured": false,
    "awards": null,
    "require_player_photo": false,
    "assigned_cabinets": [],
    "tidbit_prompt": "Interesting tidbit about yourself",
    "scene_display_name": "New York"
  },
  {
    "id": 681,
    "name": "Wonderville Open Hive Night 05/21/2025",
    "scene": 15,
    "scene_name": "nyc",
    "slug": "kqohn20250521",
    "date": "2025-05-21",
    "is_active": false,
    "location": "",
    "description": "",
    "allow_registration": false,
    "registration_close_date": null,
    "registration_banner": null,
    "accept_payments": false,
    "link_type": "challonge",
    "registration_message": "",
    "payment_message": "",
    "stripe_configured": false,
    "awards": null,
    "require_player_photo": false,
    "assigned_cabinets": [],
    "tidbit_prompt": "Interesting tidbit about yourself",
    "scene_display_name": "New York"
  },
  {
    "id": 679,
    "name": "Wonderville Open Hive Night 05/14/2025",
    "scene": 15,
    "scene_name": "nyc",
    "slug": "kqohn20250514",
    "date": "2025-05-14",
    "is_active": false,
    "location": "",
    "description": "",
    "allow_registration": false,
    "registration_close_date": null,
    "registration_banner": null,
    "accept_payments": false,
    "link_type": "challonge",
    "registration_message": "",
    "payment_message": "",
    "stripe_configured": false,
    "awards": null,
    "require_player_photo": false,
    "assigned_cabinets": [],
    "tidbit_prompt": "Interesting tidbit about yourself",
    "scene_display_name": "New York"
  },
  {
    "id": 676,
    "name": "Monday League Finals",
    "scene": 15,
    "scene_name": "nyc",
    "slug": "belltel-league-finals",
    "date": "2025-05-12",
    "is_active": false,
    "location": "",
    "description": "",
    "allow_registration": false,
    "registration_close_date": null,
    "registration_banner": null,
    "accept_payments": false,
    "link_type": "hivemind",
    "registration_message": "",
    "payment_message": "",
    "stripe_configured": false,
    "awards": null,
    "require_player_photo": false,
    "assigned_cabinets": [
      78
    ],
    "tidbit_prompt": "Interesting tidbit about yourself",
    "scene_display_name": "New York"
  },
  {
    "id": 674,
    "name": "Wonderville Open Hive Night 05/07/2025",
    "scene": 15,
    "scene_name": "nyc",
    "slug": "kqohn20250507",
    "date": "2025-05-07",
    "is_active": false,
    "location": "",
    "description": "",
    "allow_registration": false,
    "registration_close_date": null,
    "registration_banner": null,
    "accept_payments": false,
    "link_type": "challonge",
    "registration_message": "",
    "payment_message": "",
    "stripe_configured": false,
    "awards": null,
    "require_player_photo": false,
    "assigned_cabinets": [],
    "tidbit_prompt": "Interesting tidbit about yourself",
    "scene_display_name": "New York"
  },
  {
    "id": 672,
    "name": "Wonderville Open Hive Night 04/30/2025",
    "scene": 15,
    "scene_name": "nyc",
    "slug": "kqohn20250430",
    "date": "2025-04-30",
    "is_active": false,
    "location": "",
    "description": "",
    "allow_registration": false,
    "registration_close_date": null,
    "registration_banner": null,
    "accept_payments": false,
    "link_type": "challonge",
    "registration_message": "",
    "payment_message": "",
    "stripe_configured": false,
    "awards": null,
    "require_player_photo": false,
    "assigned_cabinets": [],
    "tidbit_prompt": "Interesting tidbit about yourself",
    "scene_display_name": "New York"
  },
  {
    "id": 668,
    "name": "Wonderville \"May\" 2025 BYOT",
    "scene": 15,
    "scene_name": "nyc",
    "slug": "byot20250427",
    "date": "2025-04-27",
    "is_active": false,
    "location": "",
    "description": "",
    "allow_registration": false,
    "registration_close_date": null,
    "registration_banner": null,
    "accept_payments": false,
    "link_type": "challonge",
    "registration_message": "",
    "payment_message": "",
    "stripe_configured": false,
    "awards": null,
    "require_player_photo": false,
    "assigned_cabinets": [],
    "tidbit_prompt": "Interesting tidbit about yourself",
    "scene_display_name": "New York"
  },
  {
    "id": 666,
    "name": "Wonderville Open Hive Night 04/23/2025",
    "scene": 15,
    "scene_name": "nyc",
    "slug": "kqohn20250423",
    "date": "2025-04-23",
    "is_active": false,
    "location": "",
    "description": "",
    "allow_registration": false,
    "registration_close_date": null,
    "registration_banner": null,
    "accept_payments": false,
    "link_type": "challonge",
    "registration_message": "",
    "payment_message": "",
    "stripe_configured": false,
    "awards": null,
    "require_player_photo": false,
    "assigned_cabinets": [],
    "tidbit_prompt": "Interesting tidbit about yourself",
    "scene_display_name": "New York"
  },
  {
    "id": 660,
    "name": "Wonderville Open Hive Night 04/16/2025",
    "scene": 15,
    "scene_name": "nyc",
    "slug": "kqohn20250416",
    "date": "2025-04-16",
    "is_active": false,
    "location": "",
    "description": "",
    "allow_registration": false,
    "registration_close_date": null,
    "registration_banner": null,
    "accept_payments": false,
    "link_type": "challonge",
    "registration_message": "",
    "payment_message": "",
    "stripe_configured": false,
    "awards": null,
    "require_player_photo": false,
    "assigned_cabinets": [],
    "tidbit_prompt": "Interesting tidbit about yourself",
    "scene_display_name": "New York"
  },
  {
    "id": 651,
    "name": "Wonderville Open Hive Night 04/09/2025",
    "scene": 15,
    "scene_name": "nyc",
    "slug": "kqohn20250409",
    "date": "2025-04-09",
    "is_active": false,
    "location": "",
    "description": "",
    "allow_registration": false,
    "registration_close_date": null,
    "registration_banner": null,
    "accept_payments": false,
    "link_type": "challonge",
    "registration_message": "",
    "payment_message": "",
    "stripe_configured": false,
    "awards": null,
    "require_player_photo": false,
    "assigned_cabinets": [],
    "tidbit_prompt": "Interesting tidbit about yourself",
    "scene_display_name": "New York"
  },
  {
    "id": 648,
    "name": "KQNYC April 2025 BYOT Ladder",
    "scene": 15,
    "scene_name": "nyc",
    "slug": "kqnyc-april-2025-byot-ladder",
    "date": "2025-04-05",
    "is_active": false,
    "location": "",
    "description": "",
    "allow_registration": false,
    "registration_close_date": null,
    "registration_banner": null,
    "accept_payments": false,
    "link_type": "manual",
    "registration_message": "",
    "payment_message": "",
    "stripe_configured": false,
    "awards": null,
    "require_player_photo": false,
    "assigned_cabinets": [
      29
    ],
    "tidbit_prompt": "Interesting tidbit about yourself",
    "scene_display_name": "New York"
  },
  {
    "id": 646,
    "name": "KQNYC April 2025 BYOT",
    "scene": 15,
    "scene_name": "nyc",
    "slug": "kqnyc-april-2025-byot",
    "date": "2025-04-05",
    "is_active": false,
    "location": "",
    "description": "",
    "allow_registration": false,
    "registration_close_date": null,
    "registration_banner": null,
    "accept_payments": false,
    "link_type": "challonge",
    "registration_message": "",
    "payment_message": "",
    "stripe_configured": false,
    "awards": null,
    "require_player_photo": false,
    "assigned_cabinets": [],
    "tidbit_prompt": "Interesting tidbit about yourself",
    "scene_display_name": "New York"
  },
  {
    "id": 644,
    "name": "Wonderville Open Hive Night 04/02/2025",
    "scene": 15,
    "scene_name": "nyc",
    "slug": "kqohn20250402",
    "date": "2025-04-02",
    "is_active": false,
    "location": "",
    "description": "",
    "allow_registration": false,
    "registration_close_date": null,
    "registration_banner": null,
    "accept_payments": false,
    "link_type": "challonge",
    "registration_message": "",
    "payment_message": "",
    "stripe_configured": false,
    "awards": null,
    "require_player_photo": false,
    "assigned_cabinets": [],
    "tidbit_prompt": "Interesting tidbit about yourself",
    "scene_display_name": "New York"
  },
  {
    "id": 641,
    "name": "Wonderville Open Hive Night 03/26/2025",
    "scene": 15,
    "scene_name": "nyc",
    "slug": "kqohn20250326",
    "date": "2025-03-26",
    "is_active": false,
    "location": "",
    "description": "",
    "allow_registration": false,
    "registration_close_date": null,
    "registration_banner": null,
    "accept_payments": false,
    "link_type": "challonge",
    "registration_message": "",
    "payment_message": "",
    "stripe_configured": false,
    "awards": null,
    "require_player_photo": false,
    "assigned_cabinets": [],
    "tidbit_prompt": "Interesting tidbit about yourself",
    "scene_display_name": "New York"
  },
  {
    "id": 636,
    "name": "Wonderville Open Hive Night 03/19/2025",
    "scene": 15,
    "scene_name": "nyc",
    "slug": "kqohn20250319",
    "date": "2025-03-19",
    "is_active": false,
    "location": "",
    "description": "",
    "allow_registration": false,
    "registration_close_date": null,
    "registration_banner": null,
    "accept_payments": false,
    "link_type": "challonge",
    "registration_message": "",
    "payment_message": "",
    "stripe_configured": false,
    "awards": null,
    "require_player_photo": false,
    "assigned_cabinets": [],
    "tidbit_prompt": "Interesting tidbit about yourself",
    "scene_display_name": "New York"
  },
  {
    "id": 630,
    "name": "Wonderville Open Hive Night 03/12/2025",
    "scene": 15,
    "scene_name": "nyc",
    "slug": "kqohn20250312",
    "date": "2025-03-12",
    "is_active": false,
    "location": "",
    "description": "",
    "allow_registration": false,
    "registration_close_date": null,
    "registration_banner": null,
    "accept_payments": false,
    "link_type": "challonge",
    "registration_message": "",
    "payment_message": "",
    "stripe_configured": false,
    "awards": null,
    "require_player_photo": false,
    "assigned_cabinets": [],
    "tidbit_prompt": "Interesting tidbit about yourself",
    "scene_display_name": "New York"
  },
  {
    "id": 622,
    "name": "Wonderville Open Hive Night 03/05/2025",
    "scene": 15,
    "scene_name": "nyc",
    "slug": "kqohn20250305",
    "date": "2025-03-05",
    "is_active": false,
    "location": "",
    "description": "",
    "allow_registration": false,
    "registration_close_date": null,
    "registration_banner": null,
    "accept_payments": false,
    "link_type": "challonge",
    "registration_message": "",
    "payment_message": "",
    "stripe_configured": false,
    "awards": null,
    "require_player_photo": false,
    "assigned_cabinets": [],
    "tidbit_prompt": "Interesting tidbit about yourself",
    "scene_display_name": "New York"
  },
  {
    "id": 619,
    "name": "Wonderville March 2025 BYOT - Manual",
    "scene": 15,
    "scene_name": "nyc",
    "slug": "wonderville-march-2025-byot-manual",
    "date": "2025-03-01",
    "is_active": false,
    "location": "",
    "description": "",
    "allow_registration": false,
    "registration_close_date": null,
    "registration_banner": null,
    "accept_payments": false,
    "link_type": "manual",
    "registration_message": "",
    "payment_message": "",
    "stripe_configured": false,
    "awards": null,
    "require_player_photo": false,
    "assigned_cabinets": [],
    "tidbit_prompt": "Interesting tidbit about yourself",
    "scene_display_name": "New York"
  },
  {
    "id": 618,
    "name": "Wonderville March 2025 BYOT",
    "scene": 15,
    "scene_name": "nyc",
    "slug": "wonderville-march-2025-byot",
    "date": "2025-03-01",
    "is_active": false,
    "location": "",
    "description": "",
    "allow_registration": false,
    "registration_close_date": null,
    "registration_banner": null,
    "accept_payments": false,
    "link_type": "challonge",
    "registration_message": "",
    "payment_message": "",
    "stripe_configured": false,
    "awards": null,
    "require_player_photo": false,
    "assigned_cabinets": [],
    "tidbit_prompt": "Interesting tidbit about yourself",
    "scene_display_name": "New York"
  },
  {
    "id": 616,
    "name": "Wonderville Open Hive Night 2/26/2025",
    "scene": 15,
    "scene_name": "nyc",
    "slug": "kqohn20250226",
    "date": "2025-02-26",
    "is_active": false,
    "location": "",
    "description": "",
    "allow_registration": false,
    "registration_close_date": null,
    "registration_banner": null,
    "accept_payments": false,
    "link_type": "challonge",
    "registration_message": "",
    "payment_message": "",
    "stripe_configured": false,
    "awards": null,
    "require_player_photo": false,
    "assigned_cabinets": [],
    "tidbit_prompt": "Interesting tidbit about yourself",
    "scene_display_name": "New York"
  },
  {
    "id": 611,
    "name": "Wonderville Open Hive Night 02/19/2025",
    "scene": 15,
    "scene_name": "nyc",
    "slug": "kqohn20250219",
    "date": "2025-02-19",
    "is_active": false,
    "location": "",
    "description": "",
    "allow_registration": false,
    "registration_close_date": null,
    "registration_banner": null,
    "accept_payments": false,
    "link_type": "challonge",
    "registration_message": "",
    "payment_message": "",
    "stripe_configured": false,
    "awards": null,
    "require_player_photo": false,
    "assigned_cabinets": [],
    "tidbit_prompt": "Interesting tidbit about yourself",
    "scene_display_name": "New York"
  },
  {
    "id": 610,
    "name": "Wonderville Open Hive Night 02/12/2025",
    "scene": 15,
    "scene_name": "nyc",
    "slug": "kqohn20250212",
    "date": "2025-02-12",
    "is_active": false,
    "location": "",
    "description": "",
    "allow_registration": false,
    "registration_close_date": null,
    "registration_banner": null,
    "accept_payments": false,
    "link_type": "challonge",
    "registration_message": "",
    "payment_message": "",
    "stripe_configured": false,
    "awards": null,
    "require_player_photo": false,
    "assigned_cabinets": [],
    "tidbit_prompt": "Interesting tidbit about yourself",
    "scene_display_name": "New York"
  },
  {
    "id": 607,
    "name": "Wonderville Open Hive Night 02/05/2025 (Manual)",
    "scene": 15,
    "scene_name": "nyc",
    "slug": "wonderville-open-hive-night-02052025-m",
    "date": "2025-02-05",
    "is_active": false,
    "location": "",
    "description": "",
    "allow_registration": false,
    "registration_close_date": null,
    "registration_banner": null,
    "accept_payments": false,
    "link_type": "manual",
    "registration_message": "",
    "payment_message": "",
    "stripe_configured": false,
    "awards": null,
    "require_player_photo": false,
    "assigned_cabinets": [
      29
    ],
    "tidbit_prompt": "Interesting tidbit about yourself",
    "scene_display_name": "New York"
  },
  {
    "id": 606,
    "name": "Wonderville Open Hive Night 02/05/2025",
    "scene": 15,
    "scene_name": "nyc",
    "slug": "kqohn20250205",
    "date": "2025-02-05",
    "is_active": false,
    "location": "",
    "description": "",
    "allow_registration": false,
    "registration_close_date": null,
    "registration_banner": null,
    "accept_payments": false,
    "link_type": "challonge",
    "registration_message": "",
    "payment_message": "",
    "stripe_configured": false,
    "awards": null,
    "require_player_photo": false,
    "assigned_cabinets": [],
    "tidbit_prompt": "Interesting tidbit about yourself",
    "scene_display_name": "New York"
  },
  {
    "id": 600,
    "name": "Wonderville February 2025 BYOT",
    "scene": 15,
    "scene_name": "nyc",
    "slug": "byot20250201",
    "date": "2025-02-01",
    "is_active": false,
    "location": "",
    "description": "",
    "allow_registration": false,
    "registration_close_date": null,
    "registration_banner": null,
    "accept_payments": false,
    "link_type": "challonge",
    "registration_message": "",
    "payment_message": "",
    "stripe_configured": false,
    "awards": null,
    "require_player_photo": false,
    "assigned_cabinets": [],
    "tidbit_prompt": "Interesting tidbit about yourself",
    "scene_display_name": "New York"
  },
  {
    "id": 598,
    "name": "Wonderville Open Hive Night 01/29/2025",
    "scene": 15,
    "scene_name": "nyc",
    "slug": "kqohn20250129",
    "date": "2025-01-29",
    "is_active": false,
    "location": "",
    "description": "",
    "allow_registration": false,
    "registration_close_date": null,
    "registration_banner": null,
    "accept_payments": false,
    "link_type": "challonge",
    "registration_message": "",
    "payment_message": "",
    "stripe_configured": false,
    "awards": null,
    "require_player_photo": false,
    "assigned_cabinets": [],
    "tidbit_prompt": "Interesting tidbit about yourself",
    "scene_display_name": "New York"
  },
  {
    "id": 592,
    "name": "Wonderville Open Hive Night 1/22/2025",
    "scene": 15,
    "scene_name": "nyc",
    "slug": "kqohn20250122",
    "date": "2025-01-22",
    "is_active": false,
    "location": "",
    "description": "",
    "allow_registration": false,
    "registration_close_date": null,
    "registration_banner": null,
    "accept_payments": false,
    "link_type": "challonge",
    "registration_message": "",
    "payment_message": "",
    "stripe_configured": false,
    "awards": null,
    "require_player_photo": false,
    "assigned_cabinets": [],
    "tidbit_prompt": "Interesting tidbit about yourself",
    "scene_display_name": "New York"
  },
  {
    "id": 589,
    "name": "Wonderville Open Hive Night 1/15/2025",
    "scene": 15,
    "scene_name": "nyc",
    "slug": "kqohn20250115",
    "date": "2025-01-15",
    "is_active": false,
    "location": "",
    "description": "",
    "allow_registration": false,
    "registration_close_date": null,
    "registration_banner": null,
    "accept_payments": false,
    "link_type": "challonge",
    "registration_message": "",
    "payment_message": "",
    "stripe_configured": false,
    "awards": null,
    "require_player_photo": false,
    "assigned_cabinets": [],
    "tidbit_prompt": "Interesting tidbit about yourself",
    "scene_display_name": "New York"
  },
  {
    "id": 583,
    "name": "Wonderville Open Hive Night 1/8/2025",
    "scene": 15,
    "scene_name": "nyc",
    "slug": "kqohn20250108",
    "date": "2025-01-08",
    "is_active": false,
    "location": "",
    "description": "",
    "allow_registration": false,
    "registration_close_date": null,
    "registration_banner": null,
    "accept_payments": false,
    "link_type": "challonge",
    "registration_message": "",
    "payment_message": "",
    "stripe_configured": false,
    "awards": null,
    "require_player_photo": false,
    "assigned_cabinets": [],
    "tidbit_prompt": "Interesting tidbit about yourself",
    "scene_display_name": "New York"
  },
  {
    "id": 581,
    "name": "Wonderville January 2025 BYOT",
    "scene": 15,
    "scene_name": "nyc",
    "slug": "byot20250103",
    "date": "2025-01-04",
    "is_active": false,
    "location": "",
    "description": "",
    "allow_registration": false,
    "registration_close_date": null,
    "registration_banner": null,
    "accept_payments": false,
    "link_type": "challonge",
    "registration_message": "",
    "payment_message": "",
    "stripe_configured": false,
    "awards": null,
    "require_player_photo": false,
    "assigned_cabinets": [
      29
    ],
    "tidbit_prompt": "Interesting tidbit about yourself",
    "scene_display_name": "New York"
  },
  {
    "id": 576,
    "name": "Wonderville Open Hive Night 12/18/2024",
    "scene": 15,
    "scene_name": "nyc",
    "slug": "kqohn20241218",
    "date": "2024-12-18",
    "is_active": false,
    "location": "",
    "description": "",
    "allow_registration": false,
    "registration_close_date": null,
    "registration_banner": null,
    "accept_payments": false,
    "link_type": "challonge",
    "registration_message": "",
    "payment_message": "",
    "stripe_configured": false,
    "awards": null,
    "require_player_photo": false,
    "assigned_cabinets": [],
    "tidbit_prompt": "Interesting tidbit about yourself",
    "scene_display_name": "New York"
  },
  {
    "id": 571,
    "name": "Wonderville Green Queen Night 12/11/2024",
    "scene": 15,
    "scene_name": "nyc",
    "slug": "kqohn20241211",
    "date": "2024-12-11",
    "is_active": false,
    "location": "",
    "description": "",
    "allow_registration": false,
    "registration_close_date": null,
    "registration_banner": null,
    "accept_payments": false,
    "link_type": "challonge",
    "registration_message": "",
    "payment_message": "",
    "stripe_configured": false,
    "awards": null,
    "require_player_photo": false,
    "assigned_cabinets": [],
    "tidbit_prompt": "Interesting tidbit about yourself",
    "scene_display_name": "New York"
  },
  {
    "id": 565,
    "name": "Wonderville December 2024 BYOT",
    "scene": 15,
    "scene_name": "nyc",
    "slug": "byot20241207",
    "date": "2024-12-07",
    "is_active": false,
    "location": "",
    "description": "",
    "allow_registration": false,
    "registration_close_date": null,
    "registration_banner": null,
    "accept_payments": false,
    "link_type": "challonge",
    "registration_message": "",
    "payment_message": "",
    "stripe_configured": false,
    "awards": null,
    "require_player_photo": false,
    "assigned_cabinets": [],
    "tidbit_prompt": "Interesting tidbit about yourself",
    "scene_display_name": "New York"
  },
  {
    "id": 563,
    "name": "Wonderville Open Hive Night 12/4/2024",
    "scene": 15,
    "scene_name": "nyc",
    "slug": "kqohn20241204",
    "date": "2024-12-04",
    "is_active": false,
    "location": "",
    "description": "",
    "allow_registration": false,
    "registration_close_date": null,
    "registration_banner": null,
    "accept_payments": false,
    "link_type": "challonge",
    "registration_message": "",
    "payment_message": "",
    "stripe_configured": false,
    "awards": null,
    "require_player_photo": false,
    "assigned_cabinets": [],
    "tidbit_prompt": "Interesting tidbit about yourself",
    "scene_display_name": "New York"
  },
  {
    "id": 555,
    "name": "Wonderville Open Hive Night 11/27/2024",
    "scene": 15,
    "scene_name": "nyc",
    "slug": "kqohn20241127",
    "date": "2024-11-27",
    "is_active": false,
    "location": "",
    "description": "",
    "allow_registration": false,
    "registration_close_date": null,
    "registration_banner": null,
    "accept_payments": false,
    "link_type": "challonge",
    "registration_message": "",
    "payment_message": "",
    "stripe_configured": false,
    "awards": null,
    "require_player_photo": false,
    "assigned_cabinets": [],
    "tidbit_prompt": "Interesting tidbit about yourself",
    "scene_display_name": "New York"
  },
  {
    "id": 548,
    "name": "Wonderville Open Hive Night 11/20/2024",
    "scene": 15,
    "scene_name": "nyc",
    "slug": "kqohn20241120",
    "date": "2024-11-20",
    "is_active": false,
    "location": "",
    "description": "",
    "allow_registration": false,
    "registration_close_date": null,
    "registration_banner": null,
    "accept_payments": false,
    "link_type": "challonge",
    "registration_message": "",
    "payment_message": "",
    "stripe_configured": false,
    "awards": null,
    "require_player_photo": false,
    "assigned_cabinets": [],
    "tidbit_prompt": "Interesting tidbit about yourself",
    "scene_display_name": "New York"
  },
  {
    "id": 544,
    "name": "Wonderville Open Hive Night 11/13/2024",
    "scene": 15,
    "scene_name": "nyc",
    "slug": "kqohn20241113",
    "date": "2024-11-13",
    "is_active": false,
    "location": "",
    "description": "",
    "allow_registration": false,
    "registration_close_date": null,
    "registration_banner": null,
    "accept_payments": false,
    "link_type": "challonge",
    "registration_message": "",
    "payment_message": "",
    "stripe_configured": false,
    "awards": null,
    "require_player_photo": false,
    "assigned_cabinets": [],
    "tidbit_prompt": "Interesting tidbit about yourself",
    "scene_display_name": "New York"
  },
  {
    "id": 539,
    "name": "Wonderville Open Hive Night 11/06/2024",
    "scene": 15,
    "scene_name": "nyc",
    "slug": "kqohn20241106",
    "date": "2024-11-06",
    "is_active": false,
    "location": "",
    "description": "",
    "allow_registration": false,
    "registration_close_date": null,
    "registration_banner": null,
    "accept_payments": false,
    "link_type": "challonge",
    "registration_message": "",
    "payment_message": "",
    "stripe_configured": false,
    "awards": null,
    "require_player_photo": false,
    "assigned_cabinets": [],
    "tidbit_prompt": "Interesting tidbit about yourself",
    "scene_display_name": "New York"
  },
  {
    "id": 534,
    "name": "Wonderville November 2024 BYOT",
    "scene": 15,
    "scene_name": "nyc",
    "slug": "wonderville-november-2024-byot",
    "date": "2024-11-02",
    "is_active": false,
    "location": "",
    "description": "",
    "allow_registration": false,
    "registration_close_date": null,
    "registration_banner": null,
    "accept_payments": false,
    "link_type": "challonge",
    "registration_message": "",
    "payment_message": "",
    "stripe_configured": false,
    "awards": null,
    "require_player_photo": false,
    "assigned_cabinets": [],
    "tidbit_prompt": "Interesting tidbit about yourself",
    "scene_display_name": "New York"
  },
  {
    "id": 533,
    "name": "Wonderville Open Hive Night 10/30/2024",
    "scene": 15,
    "scene_name": "nyc",
    "slug": "kqohn20241030",
    "date": "2024-10-30",
    "is_active": false,
    "location": "",
    "description": "",
    "allow_registration": false,
    "registration_close_date": null,
    "registration_banner": null,
    "accept_payments": false,
    "link_type": "challonge",
    "registration_message": "",
    "payment_message": "",
    "stripe_configured": false,
    "awards": null,
    "require_player_photo": false,
    "assigned_cabinets": [
      29
    ],
    "tidbit_prompt": "Interesting tidbit about yourself",
    "scene_display_name": "New York"
  },
  {
    "id": 528,
    "name": "Wonderville Open Hive Night 10/23/2024",
    "scene": 15,
    "scene_name": "nyc",
    "slug": "wonderville-open-hive-night-10232024",
    "date": "2024-10-23",
    "is_active": false,
    "location": "",
    "description": "",
    "allow_registration": false,
    "registration_close_date": null,
    "registration_banner": null,
    "accept_payments": false,
    "link_type": "challonge",
    "registration_message": "",
    "payment_message": "",
    "stripe_configured": false,
    "awards": null,
    "require_player_photo": false,
    "assigned_cabinets": [
      29
    ],
    "tidbit_prompt": "Interesting tidbit about yourself",
    "scene_display_name": "New York"
  },
  {
    "id": 516,
    "name": "Wonderville Open Hive Night 10/16/2024",
    "scene": 15,
    "scene_name": "nyc",
    "slug": "kqohn20241016",
    "date": "2024-10-16",
    "is_active": false,
    "location": "",
    "description": "",
    "allow_registration": false,
    "registration_close_date": null,
    "registration_banner": null,
    "accept_payments": false,
    "link_type": "challonge",
    "registration_message": "",
    "payment_message": "",
    "stripe_configured": false,
    "awards": null,
    "require_player_photo": false,
    "assigned_cabinets": [],
    "tidbit_prompt": "Interesting tidbit about yourself",
    "scene_display_name": "New York"
  },
  {
    "id": 508,
    "name": "Wonderville Open Hive Night 10/9/2024",
    "scene": 15,
    "scene_name": "nyc",
    "slug": "kqohn20241009",
    "date": "2024-10-09",
    "is_active": false,
    "location": "",
    "description": "",
    "allow_registration": false,
    "registration_close_date": null,
    "registration_banner": null,
    "accept_payments": false,
    "link_type": "challonge",
    "registration_message": "",
    "payment_message": "",
    "stripe_configured": false,
    "awards": null,
    "require_player_photo": false,
    "assigned_cabinets": [
      29
    ],
    "tidbit_prompt": "Interesting tidbit about yourself",
    "scene_display_name": "New York"
  },
  {
    "id": 505,
    "name": "Wonderville October BYOT",
    "scene": 15,
    "scene_name": "nyc",
    "slug": "byot20241005",
    "date": "2024-10-05",
    "is_active": false,
    "location": "",
    "description": "",
    "allow_registration": false,
    "registration_close_date": null,
    "registration_banner": null,
    "accept_payments": false,
    "link_type": "challonge",
    "registration_message": "",
    "payment_message": "",
    "stripe_configured": false,
    "awards": null,
    "require_player_photo": false,
    "assigned_cabinets": [
      29
    ],
    "tidbit_prompt": "Interesting tidbit about yourself",
    "scene_display_name": "New York"
  },
  {
    "id": 503,
    "name": "Wonderville Open Hive Night 10/02/2024",
    "scene": 15,
    "scene_name": "nyc",
    "slug": "kqohn20241002",
    "date": "2024-10-02",
    "is_active": false,
    "location": "",
    "description": "",
    "allow_registration": false,
    "registration_close_date": null,
    "registration_banner": null,
    "accept_payments": false,
    "link_type": "challonge",
    "registration_message": "",
    "payment_message": "",
    "stripe_configured": false,
    "awards": null,
    "require_player_photo": false,
    "assigned_cabinets": [
      29
    ],
    "tidbit_prompt": "Interesting tidbit about yourself",
    "scene_display_name": "New York"
  },
  {
    "id": 497,
    "name": "Wonderville Open Hive Night 09/25/2024",
    "scene": 15,
    "scene_name": "nyc",
    "slug": "kqohn20240925",
    "date": "2024-09-25",
    "is_active": false,
    "location": "",
    "description": "",
    "allow_registration": false,
    "registration_close_date": null,
    "registration_banner": null,
    "accept_payments": false,
    "link_type": "challonge",
    "registration_message": "",
    "payment_message": "",
    "stripe_configured": false,
    "awards": null,
    "require_player_photo": false,
    "assigned_cabinets": [
      29
    ],
    "tidbit_prompt": "Interesting tidbit about yourself",
    "scene_display_name": "New York"
  },
  {
    "id": 491,
    "name": "Wonderville Open Hive Night 09/18/2024",
    "scene": 15,
    "scene_name": "nyc",
    "slug": "wonderville-open-hive-night-09182024",
    "date": "2024-09-18",
    "is_active": false,
    "location": "",
    "description": "",
    "allow_registration": false,
    "registration_close_date": null,
    "registration_banner": null,
    "accept_payments": false,
    "link_type": "challonge",
    "registration_message": "",
    "payment_message": "",
    "stripe_configured": false,
    "awards": null,
    "require_player_photo": false,
    "assigned_cabinets": [
      29
    ],
    "tidbit_prompt": "Interesting tidbit about yourself",
    "scene_display_name": "New York"
  },
  {
    "id": 486,
    "name": "Wonderville Open Hive Night 09/11/2024",
    "scene": 15,
    "scene_name": "nyc",
    "slug": "wonderville-open-hive-night-09112024",
    "date": "2024-09-11",
    "is_active": false,
    "location": "",
    "description": "",
    "allow_registration": false,
    "registration_close_date": null,
    "registration_banner": null,
    "accept_payments": false,
    "link_type": "challonge",
    "registration_message": "",
    "payment_message": "",
    "stripe_configured": false,
    "awards": null,
    "require_player_photo": false,
    "assigned_cabinets": [
      29
    ],
    "tidbit_prompt": "Interesting tidbit about yourself",
    "scene_display_name": "New York"
  },
  {
    "id": 484,
    "name": "Wonderville September 2024 BYOT",
    "scene": 15,
    "scene_name": "nyc",
    "slug": "wonderville-september-2024-byot",
    "date": "2024-09-07",
    "is_active": false,
    "location": "",
    "description": "",
    "allow_registration": false,
    "registration_close_date": null,
    "registration_banner": null,
    "accept_payments": false,
    "link_type": "challonge",
    "registration_message": "",
    "payment_message": "",
    "stripe_configured": false,
    "awards": null,
    "require_player_photo": false,
    "assigned_cabinets": [],
    "tidbit_prompt": "Interesting tidbit about yourself",
    "scene_display_name": "New York"
  },
  {
    "id": 480,
    "name": "Wonderville Open Hive Night 09/04/2024",
    "scene": 15,
    "scene_name": "nyc",
    "slug": "wonderville-open-hive-night-09042024",
    "date": "2024-09-04",
    "is_active": false,
    "location": "",
    "description": "",
    "allow_registration": false,
    "registration_close_date": null,
    "registration_banner": null,
    "accept_payments": false,
    "link_type": "challonge",
    "registration_message": "",
    "payment_message": "",
    "stripe_configured": false,
    "awards": null,
    "require_player_photo": false,
    "assigned_cabinets": [
      29
    ],
    "tidbit_prompt": "Interesting tidbit about yourself",
    "scene_display_name": "New York"
  },
  {
    "id": 472,
    "name": "Wonderville Open Hive Night 08/28/2024",
    "scene": 15,
    "scene_name": "nyc",
    "slug": "wonderville-open-hive-night-08282024",
    "date": "2024-08-28",
    "is_active": false,
    "location": "",
    "description": "",
    "allow_registration": false,
    "registration_close_date": null,
    "registration_banner": null,
    "accept_payments": false,
    "link_type": "challonge",
    "registration_message": "",
    "payment_message": "",
    "stripe_configured": false,
    "awards": null,
    "require_player_photo": false,
    "assigned_cabinets": [],
    "tidbit_prompt": "Interesting tidbit about yourself",
    "scene_display_name": "New York"
  },
  {
    "id": 466,
    "name": "Wonderville Open Hive Night 08/21/2024",
    "scene": 15,
    "scene_name": "nyc",
    "slug": "wonderville-open-hive-night-08212024",
    "date": "2024-08-21",
    "is_active": false,
    "location": "",
    "description": "",
    "allow_registration": false,
    "registration_close_date": null,
    "registration_banner": null,
    "accept_payments": false,
    "link_type": "challonge",
    "registration_message": "",
    "payment_message": "",
    "stripe_configured": false,
    "awards": null,
    "require_player_photo": false,
    "assigned_cabinets": [
      29
    ],
    "tidbit_prompt": "Interesting tidbit about yourself",
    "scene_display_name": "New York"
  },
  {
    "id": 462,
    "name": "Wonderville Open Hive Night 08/14/2024",
    "scene": 15,
    "scene_name": "nyc",
    "slug": "wonderville-open-hive-night-08142024",
    "date": "2024-08-14",
    "is_active": false,
    "location": "",
    "description": "",
    "allow_registration": false,
    "registration_close_date": null,
    "registration_banner": null,
    "accept_payments": false,
    "link_type": "challonge",
    "registration_message": "",
    "payment_message": "",
    "stripe_configured": false,
    "awards": null,
    "require_player_photo": false,
    "assigned_cabinets": [
      29
    ],
    "tidbit_prompt": "Interesting tidbit about yourself",
    "scene_display_name": "New York"
  },
  {
    "id": 457,
    "name": "Wonderville Open Hive Night 08/07/2024",
    "scene": 15,
    "scene_name": "nyc",
    "slug": "wonderville-open-hive-night-08072024",
    "date": "2024-08-07",
    "is_active": false,
    "location": "",
    "description": "",
    "allow_registration": false,
    "registration_close_date": null,
    "registration_banner": null,
    "accept_payments": false,
    "link_type": "challonge",
    "registration_message": "",
    "payment_message": "",
    "stripe_configured": false,
    "awards": null,
    "require_player_photo": false,
    "assigned_cabinets": [
      29
    ],
    "tidbit_prompt": "Interesting tidbit about yourself",
    "scene_display_name": "New York"
  },
  {
    "id": 450,
    "name": "Wonderville Open Hive Night 07/31/2024",
    "scene": 15,
    "scene_name": "nyc",
    "slug": "wonderville-open-hive-night-07312024",
    "date": "2024-07-31",
    "is_active": false,
    "location": "",
    "description": "",
    "allow_registration": false,
    "registration_close_date": null,
    "registration_banner": null,
    "accept_payments": false,
    "link_type": "challonge",
    "registration_message": "",
    "payment_message": "",
    "stripe_configured": false,
    "awards": null,
    "require_player_photo": false,
    "assigned_cabinets": [
      29
    ],
    "tidbit_prompt": "Interesting tidbit about yourself",
    "scene_display_name": "New York"
  },
  {
    "id": 443,
    "name": "Wonderville July BYOT - Second Edition",
    "scene": 15,
    "scene_name": "nyc",
    "slug": "wonderville-july-byot-second-edition",
    "date": "2024-07-27",
    "is_active": false,
    "location": "",
    "description": "",
    "allow_registration": false,
    "registration_close_date": null,
    "registration_banner": null,
    "accept_payments": false,
    "link_type": "challonge",
    "registration_message": "",
    "payment_message": "",
    "stripe_configured": false,
    "awards": null,
    "require_player_photo": false,
    "assigned_cabinets": [
      29
    ],
    "tidbit_prompt": "Interesting tidbit about yourself",
    "scene_display_name": "New York"
  },
  {
    "id": 440,
    "name": "Wonderville Open Hive Night 07/24/2024",
    "scene": 15,
    "scene_name": "nyc",
    "slug": "wonderville-open-hive-night-07242024",
    "date": "2024-07-24",
    "is_active": false,
    "location": "",
    "description": "",
    "allow_registration": false,
    "registration_close_date": null,
    "registration_banner": null,
    "accept_payments": false,
    "link_type": "challonge",
    "registration_message": "",
    "payment_message": "",
    "stripe_configured": false,
    "awards": null,
    "require_player_photo": false,
    "assigned_cabinets": [
      29
    ],
    "tidbit_prompt": "Interesting tidbit about yourself",
    "scene_display_name": "New York"
  },
  {
    "id": 437,
    "name": "Wonderville Open Hive Night 07/17/2024",
    "scene": 15,
    "scene_name": "nyc",
    "slug": "wonderville-open-hive-night-07172024",
    "date": "2024-07-17",
    "is_active": false,
    "location": "",
    "description": "",
    "allow_registration": false,
    "registration_close_date": null,
    "registration_banner": null,
    "accept_payments": false,
    "link_type": "challonge",
    "registration_message": "",
    "payment_message": "",
    "stripe_configured": false,
    "awards": null,
    "require_player_photo": false,
    "assigned_cabinets": [
      29
    ],
    "tidbit_prompt": "Interesting tidbit about yourself",
    "scene_display_name": "New York"
  },
  {
    "id": 434,
    "name": "Wonderville Open Hive Night 07/10/2024",
    "scene": 15,
    "scene_name": "nyc",
    "slug": "wonderville-open-hive-night-07102024",
    "date": "2024-07-10",
    "is_active": false,
    "location": "",
    "description": "beeple anonymous",
    "allow_registration": false,
    "registration_close_date": null,
    "registration_banner": null,
    "accept_payments": false,
    "link_type": "challonge",
    "registration_message": "",
    "payment_message": "",
    "stripe_configured": false,
    "awards": null,
    "require_player_photo": false,
    "assigned_cabinets": [
      29
    ],
    "tidbit_prompt": "Interesting tidbit about yourself",
    "scene_display_name": "New York"
  },
  {
    "id": 429,
    "name": "Wonderville July BYOT",
    "scene": 15,
    "scene_name": "nyc",
    "slug": "wonderville-july-byot",
    "date": "2024-07-06",
    "is_active": false,
    "location": "",
    "description": "",
    "allow_registration": false,
    "registration_close_date": null,
    "registration_banner": null,
    "accept_payments": false,
    "link_type": "challonge",
    "registration_message": "",
    "payment_message": "",
    "stripe_configured": false,
    "awards": null,
    "require_player_photo": false,
    "assigned_cabinets": [
      29
    ],
    "tidbit_prompt": "Interesting tidbit about yourself",
    "scene_display_name": "New York"
  },
  {
    "id": 427,
    "name": "Wonderville Open Hive Night 07/03/2024",
    "scene": 15,
    "scene_name": "nyc",
    "slug": "wonderville-open-hive-night-07032024",
    "date": "2024-07-03",
    "is_active": false,
    "location": "",
    "description": "",
    "allow_registration": false,
    "registration_close_date": null,
    "registration_banner": null,
    "accept_payments": false,
    "link_type": "challonge",
    "registration_message": "",
    "payment_message": "",
    "stripe_configured": false,
    "awards": null,
    "require_player_photo": false,
    "assigned_cabinets": [
      29
    ],
    "tidbit_prompt": "Interesting tidbit about yourself",
    "scene_display_name": "New York"
  },
  {
    "id": 421,
    "name": "Wonderville Open Hive Night 06/26/2024",
    "scene": 15,
    "scene_name": "nyc",
    "slug": "wonderville-open-hive-night-06262024",
    "date": "2024-06-26",
    "is_active": false,
    "location": "",
    "description": "",
    "allow_registration": false,
    "registration_close_date": null,
    "registration_banner": null,
    "accept_payments": false,
    "link_type": "challonge",
    "registration_message": "",
    "payment_message": "",
    "stripe_configured": false,
    "awards": null,
    "require_player_photo": false,
    "assigned_cabinets": [
      29
    ],
    "tidbit_prompt": "Interesting tidbit about yourself",
    "scene_display_name": "New York"
  },
  {
    "id": 418,
    "name": "Wonderville Open Hive Night 06/19/2024",
    "scene": 15,
    "scene_name": "nyc",
    "slug": "wonderville-open-hive-night-06192024",
    "date": "2024-06-19",
    "is_active": false,
    "location": "",
    "description": "",
    "allow_registration": false,
    "registration_close_date": null,
    "registration_banner": null,
    "accept_payments": false,
    "link_type": "challonge",
    "registration_message": "",
    "payment_message": "",
    "stripe_configured": false,
    "awards": null,
    "require_player_photo": false,
    "assigned_cabinets": [
      29
    ],
    "tidbit_prompt": "Interesting tidbit about yourself",
    "scene_display_name": "New York"
  },
  {
    "id": 410,
    "name": "Wonderville Open Hive Night 06/12/2024",
    "scene": 15,
    "scene_name": "nyc",
    "slug": "wonderville-open-hive-night-06122024",
    "date": "2024-06-12",
    "is_active": false,
    "location": "",
    "description": "",
    "allow_registration": false,
    "registration_close_date": null,
    "registration_banner": null,
    "accept_payments": false,
    "link_type": "challonge",
    "registration_message": "",
    "payment_message": "",
    "stripe_configured": false,
    "awards": null,
    "require_player_photo": false,
    "assigned_cabinets": [
      29
    ],
    "tidbit_prompt": "Interesting tidbit about yourself",
    "scene_display_name": "New York"
  },
  {
    "id": 407,
    "name": "Wonderville Green Queen Night 06/05/2024",
    "scene": 15,
    "scene_name": "nyc",
    "slug": "wonderville-green-queen-night-06052024",
    "date": "2024-06-05",
    "is_active": false,
    "location": "",
    "description": "",
    "allow_registration": false,
    "registration_close_date": null,
    "registration_banner": null,
    "accept_payments": false,
    "link_type": "challonge",
    "registration_message": "",
    "payment_message": "",
    "stripe_configured": false,
    "awards": null,
    "require_player_photo": false,
    "assigned_cabinets": [
      29
    ],
    "tidbit_prompt": "Interesting tidbit about yourself",
    "scene_display_name": "New York"
  },
  {
    "id": 406,
    "name": "Wonderville June 2024 BYOT",
    "scene": 15,
    "scene_name": "nyc",
    "slug": "wonderville-june-2024-byot",
    "date": "2024-06-01",
    "is_active": false,
    "location": "",
    "description": "",
    "allow_registration": false,
    "registration_close_date": null,
    "registration_banner": null,
    "accept_payments": false,
    "link_type": "challonge",
    "registration_message": "",
    "payment_message": "",
    "stripe_configured": false,
    "awards": null,
    "require_player_photo": false,
    "assigned_cabinets": [
      29
    ],
    "tidbit_prompt": "Interesting tidbit about yourself",
    "scene_display_name": "New York"
  },
  {
    "id": 403,
    "name": "Wonderville Open Hive Night 05/29/2024",
    "scene": 15,
    "scene_name": "nyc",
    "slug": "wonderville-open-hive-night-05292024",
    "date": "2024-05-29",
    "is_active": false,
    "location": "",
    "description": "",
    "allow_registration": false,
    "registration_close_date": null,
    "registration_banner": null,
    "accept_payments": false,
    "link_type": "challonge",
    "registration_message": "",
    "payment_message": "",
    "stripe_configured": false,
    "awards": null,
    "require_player_photo": false,
    "assigned_cabinets": [
      29
    ],
    "tidbit_prompt": "Interesting tidbit about yourself",
    "scene_display_name": "New York"
  },
  {
    "id": 399,
    "name": "Wonderville Open Hive Night 05/22/2024",
    "scene": 15,
    "scene_name": "nyc",
    "slug": "wonderville-open-hive-night-05222024",
    "date": "2024-05-22",
    "is_active": false,
    "location": "",
    "description": "",
    "allow_registration": false,
    "registration_close_date": null,
    "registration_banner": null,
    "accept_payments": false,
    "link_type": "challonge",
    "registration_message": "",
    "payment_message": "",
    "stripe_configured": false,
    "awards": null,
    "require_player_photo": false,
    "assigned_cabinets": [
      29
    ],
    "tidbit_prompt": "Interesting tidbit about yourself",
    "scene_display_name": "New York"
  },
  {
    "id": 397,
    "name": "Wonderville Open Hive Night 05/15/2024",
    "scene": 15,
    "scene_name": "nyc",
    "slug": "wonderville-open-hive-night-05152024",
    "date": "2024-05-15",
    "is_active": false,
    "location": "",
    "description": "",
    "allow_registration": false,
    "registration_close_date": null,
    "registration_banner": null,
    "accept_payments": false,
    "link_type": "challonge",
    "registration_message": "",
    "payment_message": "",
    "stripe_configured": false,
    "awards": null,
    "require_player_photo": false,
    "assigned_cabinets": [],
    "tidbit_prompt": "Interesting tidbit about yourself",
    "scene_display_name": "New York"
  },
  {
    "id": 392,
    "name": "Wonderville Open Hive Night 05/08/2024",
    "scene": 15,
    "scene_name": "nyc",
    "slug": "wonderville-open-hive-night-05082024",
    "date": "2024-05-08",
    "is_active": false,
    "location": "",
    "description": "",
    "allow_registration": false,
    "registration_close_date": null,
    "registration_banner": null,
    "accept_payments": false,
    "link_type": "challonge",
    "registration_message": "",
    "payment_message": "",
    "stripe_configured": false,
    "awards": null,
    "require_player_photo": false,
    "assigned_cabinets": [],
    "tidbit_prompt": "Interesting tidbit about yourself",
    "scene_display_name": "New York"
  },
  {
    "id": 385,
    "name": "Wonderville Open Hive Night 05/01/2024",
    "scene": 15,
    "scene_name": "nyc",
    "slug": "wonderville-open-hive-night-05012024",
    "date": "2024-05-01",
    "is_active": false,
    "location": "",
    "description": "",
    "allow_registration": false,
    "registration_close_date": null,
    "registration_banner": null,
    "accept_payments": false,
    "link_type": "challonge",
    "registration_message": "",
    "payment_message": "",
    "stripe_configured": false,
    "awards": null,
    "require_player_photo": false,
    "assigned_cabinets": [],
    "tidbit_prompt": "Interesting tidbit about yourself",
    "scene_display_name": "New York"
  },
  {
    "id": 380,
    "name": "Wonderville Open Hive Night 04/24/2024",
    "scene": 15,
    "scene_name": "nyc",
    "slug": "wonderville-open-hive-night-04242024",
    "date": "2024-04-24",
    "is_active": false,
    "location": "",
    "description": "",
    "allow_registration": false,
    "registration_close_date": null,
    "registration_banner": null,
    "accept_payments": false,
    "link_type": "challonge",
    "registration_message": "",
    "payment_message": "",
    "stripe_configured": false,
    "awards": null,
    "require_player_photo": false,
    "assigned_cabinets": [],
    "tidbit_prompt": "Interesting tidbit about yourself",
    "scene_display_name": "New York"
  },
  {
    "id": 377,
    "name": "Wonderville Open Hive Night 04/17/2024",
    "scene": 15,
    "scene_name": "nyc",
    "slug": "wonderville-open-hive-night-04172024",
    "date": "2024-04-17",
    "is_active": false,
    "location": "",
    "description": "",
    "allow_registration": false,
    "registration_close_date": null,
    "registration_banner": null,
    "accept_payments": false,
    "link_type": "challonge",
    "registration_message": "",
    "payment_message": "",
    "stripe_configured": false,
    "awards": null,
    "require_player_photo": false,
    "assigned_cabinets": [],
    "tidbit_prompt": "Interesting tidbit about yourself",
    "scene_display_name": "New York"
  },
  {
    "id": 371,
    "name": "Wonderville Green Queen Night 04/10/2023",
    "scene": 15,
    "scene_name": "nyc",
    "slug": "wonderville-green-queen-night-04102023",
    "date": "2024-04-10",
    "is_active": false,
    "location": "",
    "description": "",
    "allow_registration": false,
    "registration_close_date": null,
    "registration_banner": null,
    "accept_payments": false,
    "link_type": "challonge",
    "registration_message": "",
    "payment_message": "",
    "stripe_configured": false,
    "awards": null,
    "require_player_photo": false,
    "assigned_cabinets": [],
    "tidbit_prompt": "Interesting tidbit about yourself",
    "scene_display_name": "New York"
  },
  {
    "id": 369,
    "name": "April 2024 BYOT",
    "scene": 15,
    "scene_name": "nyc",
    "slug": "april-2024-byot",
    "date": "2024-04-06",
    "is_active": false,
    "location": "",
    "description": "",
    "allow_registration": false,
    "registration_close_date": null,
    "registration_banner": null,
    "accept_payments": false,
    "link_type": "challonge",
    "registration_message": "",
    "payment_message": "",
    "stripe_configured": false,
    "awards": null,
    "require_player_photo": false,
    "assigned_cabinets": [],
    "tidbit_prompt": "Interesting tidbit about yourself",
    "scene_display_name": "New York"
  },
  {
    "id": 366,
    "name": "Wonderville Open Hive Night 4/3/2024",
    "scene": 15,
    "scene_name": "nyc",
    "slug": "wonderville-open-hive-night-432024",
    "date": "2024-04-03",
    "is_active": false,
    "location": "",
    "description": "",
    "allow_registration": false,
    "registration_close_date": null,
    "registration_banner": null,
    "accept_payments": false,
    "link_type": "challonge",
    "registration_message": "",
    "payment_message": "",
    "stripe_configured": false,
    "awards": null,
    "require_player_photo": false,
    "assigned_cabinets": [],
    "tidbit_prompt": "Interesting tidbit about yourself",
    "scene_display_name": "New York"
  },
  {
    "id": 360,
    "name": "Wonderville Open Hive Night 03/27/2024",
    "scene": 15,
    "scene_name": "nyc",
    "slug": "wonderville-open-hive-night-03272024",
    "date": "2024-03-27",
    "is_active": false,
    "location": "",
    "description": "",
    "allow_registration": false,
    "registration_close_date": null,
    "registration_banner": null,
    "accept_payments": false,
    "link_type": "challonge",
    "registration_message": "",
    "payment_message": "",
    "stripe_configured": false,
    "awards": null,
    "require_player_photo": false,
    "assigned_cabinets": [],
    "tidbit_prompt": "Interesting tidbit about yourself",
    "scene_display_name": "New York"
  },
  {
    "id": 358,
    "name": "Wonderville Open Hive Night 03/20/2024",
    "scene": 15,
    "scene_name": "nyc",
    "slug": "wonderville-open-hive-night-03202024",
    "date": "2024-03-20",
    "is_active": false,
    "location": "",
    "description": "",
    "allow_registration": false,
    "registration_close_date": null,
    "registration_banner": null,
    "accept_payments": false,
    "link_type": "challonge",
    "registration_message": "",
    "payment_message": "",
    "stripe_configured": false,
    "awards": null,
    "require_player_photo": false,
    "assigned_cabinets": [],
    "tidbit_prompt": "Interesting tidbit about yourself",
    "scene_display_name": "New York"
  },
  {
    "id": 352,
    "name": "Wonderville Open Hive Night 03/13/2024",
    "scene": 15,
    "scene_name": "nyc",
    "slug": "wonderville-open-hive-night-03132024",
    "date": "2024-03-13",
    "is_active": false,
    "location": "",
    "description": "",
    "allow_registration": false,
    "registration_close_date": null,
    "registration_banner": null,
    "accept_payments": false,
    "link_type": "challonge",
    "registration_message": "",
    "payment_message": "",
    "stripe_configured": false,
    "awards": null,
    "require_player_photo": false,
    "assigned_cabinets": [],
    "tidbit_prompt": "Interesting tidbit about yourself",
    "scene_display_name": "New York"
  },
  {
    "id": 347,
    "name": "Wonderville Green Queen Night 03/06/2024",
    "scene": 15,
    "scene_name": "nyc",
    "slug": "wonderville-green-queen-night-03062024",
    "date": "2024-03-06",
    "is_active": false,
    "location": "",
    "description": "",
    "allow_registration": false,
    "registration_close_date": null,
    "registration_banner": null,
    "accept_payments": false,
    "link_type": "challonge",
    "registration_message": "",
    "payment_message": "",
    "stripe_configured": false,
    "awards": null,
    "require_player_photo": false,
    "assigned_cabinets": [],
    "tidbit_prompt": "Interesting tidbit about yourself",
    "scene_display_name": "New York"
  },
  {
    "id": 343,
    "name": "Wonderville March 2024 BYOT",
    "scene": 15,
    "scene_name": "nyc",
    "slug": "wonderville-march-2024-byot",
    "date": "2024-03-02",
    "is_active": false,
    "location": "",
    "description": "",
    "allow_registration": false,
    "registration_close_date": null,
    "registration_banner": null,
    "accept_payments": false,
    "link_type": "challonge",
    "registration_message": "",
    "payment_message": "",
    "stripe_configured": false,
    "awards": null,
    "require_player_photo": false,
    "assigned_cabinets": [],
    "tidbit_prompt": "Interesting tidbit about yourself",
    "scene_display_name": "New York"
  },
  {
    "id": 342,
    "name": "Wonderville Open Hive Night 02/28/2024",
    "scene": 15,
    "scene_name": "nyc",
    "slug": "wonderville-open-hive-night-02282024",
    "date": "2024-02-28",
    "is_active": false,
    "location": "",
    "description": "",
    "allow_registration": false,
    "registration_close_date": null,
    "registration_banner": null,
    "accept_payments": false,
    "link_type": "challonge",
    "registration_message": "",
    "payment_message": "",
    "stripe_configured": false,
    "awards": null,
    "require_player_photo": false,
    "assigned_cabinets": [],
    "tidbit_prompt": "Interesting tidbit about yourself",
    "scene_display_name": "New York"
  },
  {
    "id": 338,
    "name": "Wonderville Open Hive Night 02/21/2024",
    "scene": 15,
    "scene_name": "nyc",
    "slug": "wonderville-open-hive-night-02212024",
    "date": "2024-02-21",
    "is_active": false,
    "location": "",
    "description": "",
    "allow_registration": false,
    "registration_close_date": null,
    "registration_banner": null,
    "accept_payments": false,
    "link_type": "challonge",
    "registration_message": "",
    "payment_message": "",
    "stripe_configured": false,
    "awards": null,
    "require_player_photo": false,
    "assigned_cabinets": [],
    "tidbit_prompt": "Interesting tidbit about yourself",
    "scene_display_name": "New York"
  },
  {
    "id": 336,
    "name": "Wonderville Open Hive Night 02/14/2024 \u2764\ufe0f",
    "scene": 15,
    "scene_name": "nyc",
    "slug": "wonderville-open-hive-night-02142024",
    "date": "2024-02-14",
    "is_active": false,
    "location": "",
    "description": "",
    "allow_registration": false,
    "registration_close_date": null,
    "registration_banner": null,
    "accept_payments": false,
    "link_type": "challonge",
    "registration_message": "",
    "payment_message": "",
    "stripe_configured": false,
    "awards": null,
    "require_player_photo": false,
    "assigned_cabinets": [],
    "tidbit_prompt": "Interesting tidbit about yourself",
    "scene_display_name": "New York"
  },
  {
    "id": 332,
    "name": "Wonderville Green Queen Night",
    "scene": 15,
    "scene_name": "nyc",
    "slug": "wonderville-green-queen-night",
    "date": "2024-02-07",
    "is_active": false,
    "location": "",
    "description": "",
    "allow_registration": false,
    "registration_close_date": null,
    "registration_banner": null,
    "accept_payments": false,
    "link_type": "challonge",
    "registration_message": "",
    "payment_message": "",
    "stripe_configured": false,
    "awards": null,
    "require_player_photo": false,
    "assigned_cabinets": [],
    "tidbit_prompt": "Interesting tidbit about yourself",
    "scene_display_name": "New York"
  },
  {
    "id": 327,
    "name": "Wonderville February 2024 BYOT",
    "scene": 15,
    "scene_name": "nyc",
    "slug": "wonderville-february-2024-byot",
    "date": "2024-02-03",
    "is_active": false,
    "location": "",
    "description": "",
    "allow_registration": false,
    "registration_close_date": null,
    "registration_banner": null,
    "accept_payments": false,
    "link_type": "challonge",
    "registration_message": "",
    "payment_message": "",
    "stripe_configured": false,
    "awards": null,
    "require_player_photo": false,
    "assigned_cabinets": [],
    "tidbit_prompt": "Interesting tidbit about yourself",
    "scene_display_name": "New York"
  },
  {
    "id": 325,
    "name": "Wonderville Open Hive Night 1/31/2024",
    "scene": 15,
    "scene_name": "nyc",
    "slug": "wonderville-open-hive-night-1312024",
    "date": "2024-01-31",
    "is_active": false,
    "location": "",
    "description": "",
    "allow_registration": false,
    "registration_close_date": null,
    "registration_banner": null,
    "accept_payments": false,
    "link_type": "challonge",
    "registration_message": "",
    "payment_message": "",
    "stripe_configured": false,
    "awards": null,
    "require_player_photo": false,
    "assigned_cabinets": [],
    "tidbit_prompt": "Interesting tidbit about yourself",
    "scene_display_name": "New York"
  },
  {
    "id": 319,
    "name": "Wonderville Open Hive Night 01/24/2024",
    "scene": 15,
    "scene_name": "nyc",
    "slug": "wonderville-open-hive-night-01242024",
    "date": "2024-01-24",
    "is_active": false,
    "location": "",
    "description": "",
    "allow_registration": false,
    "registration_close_date": null,
    "registration_banner": null,
    "accept_payments": false,
    "link_type": "challonge",
    "registration_message": "",
    "payment_message": "",
    "stripe_configured": false,
    "awards": null,
    "require_player_photo": false,
    "assigned_cabinets": [],
    "tidbit_prompt": "Interesting tidbit about yourself",
    "scene_display_name": "New York"
  },
  {
    "id": 315,
    "name": "Wonderville Open Hive Night 1/17/2024",
    "scene": 15,
    "scene_name": "nyc",
    "slug": "wonderville-open-hive-night-1172024",
    "date": "2024-01-17",
    "is_active": false,
    "location": "",
    "description": "",
    "allow_registration": false,
    "registration_close_date": null,
    "registration_banner": null,
    "accept_payments": false,
    "link_type": "challonge",
    "registration_message": "",
    "payment_message": "",
    "stripe_configured": false,
    "awards": null,
    "require_player_photo": false,
    "assigned_cabinets": [],
    "tidbit_prompt": "Interesting tidbit about yourself",
    "scene_display_name": "New York"
  },
  {
    "id": 314,
    "name": "manual test tournament",
    "scene": 15,
    "scene_name": "nyc",
    "slug": "manual-test-tournament",
    "date": "2024-01-16",
    "is_active": false,
    "location": "",
    "description": "sorry, trying to see if something is broken",
    "allow_registration": false,
    "registration_close_date": null,
    "registration_banner": null,
    "accept_payments": false,
    "link_type": "manual",
    "registration_message": "",
    "payment_message": "",
    "stripe_configured": false,
    "awards": null,
    "require_player_photo": false,
    "assigned_cabinets": [],
    "tidbit_prompt": "Interesting tidbit about yourself",
    "scene_display_name": "New York"
  },
  {
    "id": 311,
    "name": "Wonderville Open Hive Night 01/10/2024",
    "scene": 15,
    "scene_name": "nyc",
    "slug": "wonderville-open-hive-night-01102024",
    "date": "2024-01-10",
    "is_active": false,
    "location": "",
    "description": "",
    "allow_registration": false,
    "registration_close_date": null,
    "registration_banner": null,
    "accept_payments": false,
    "link_type": "challonge",
    "registration_message": "",
    "payment_message": "",
    "stripe_configured": false,
    "awards": null,
    "require_player_photo": false,
    "assigned_cabinets": [],
    "tidbit_prompt": "Interesting tidbit about yourself",
    "scene_display_name": "New York"
  },
  {
    "id": 310,
    "name": "Wonderville January 2024 BYOT",
    "scene": 15,
    "scene_name": "nyc",
    "slug": "wonderville-january-2024-byot",
    "date": "2024-01-06",
    "is_active": false,
    "location": "",
    "description": "",
    "allow_registration": false,
    "registration_close_date": null,
    "registration_banner": null,
    "accept_payments": false,
    "link_type": "challonge",
    "registration_message": "",
    "payment_message": "",
    "stripe_configured": false,
    "awards": null,
    "require_player_photo": false,
    "assigned_cabinets": [],
    "tidbit_prompt": "Interesting tidbit about yourself",
    "scene_display_name": "New York"
  },
  {
    "id": 308,
    "name": "Wonderville Open Hive Night 01/03/2024",
    "scene": 15,
    "scene_name": "nyc",
    "slug": "wonderville-open-hive-night-01032024",
    "date": "2024-01-03",
    "is_active": false,
    "location": "",
    "description": "",
    "allow_registration": false,
    "registration_close_date": null,
    "registration_banner": null,
    "accept_payments": false,
    "link_type": "challonge",
    "registration_message": "",
    "payment_message": "",
    "stripe_configured": false,
    "awards": null,
    "require_player_photo": false,
    "assigned_cabinets": [],
    "tidbit_prompt": "Interesting tidbit about yourself",
    "scene_display_name": "New York"
  },
  {
    "id": 305,
    "name": "Wonderville Open Hive Night 12/27/2023",
    "scene": 15,
    "scene_name": "nyc",
    "slug": "wonderville-open-hive-night-12272023",
    "date": "2023-12-27",
    "is_active": false,
    "location": "",
    "description": "",
    "allow_registration": false,
    "registration_close_date": null,
    "registration_banner": null,
    "accept_payments": false,
    "link_type": "challonge",
    "registration_message": "",
    "payment_message": "",
    "stripe_configured": false,
    "awards": null,
    "require_player_photo": false,
    "assigned_cabinets": [],
    "tidbit_prompt": "Interesting tidbit about yourself",
    "scene_display_name": "New York"
  },
  {
    "id": 304,
    "name": "Wonderville Open Hive Night 12/20/2023",
    "scene": 15,
    "scene_name": "nyc",
    "slug": "wonderville-open-hive-night-12202023",
    "date": "2023-12-20",
    "is_active": false,
    "location": "",
    "description": "kqohn20231220",
    "allow_registration": false,
    "registration_close_date": null,
    "registration_banner": null,
    "accept_payments": false,
    "link_type": "challonge",
    "registration_message": "",
    "payment_message": "",
    "stripe_configured": false,
    "awards": null,
    "require_player_photo": false,
    "assigned_cabinets": [],
    "tidbit_prompt": "Interesting tidbit about yourself",
    "scene_display_name": "New York"
  },
  {
    "id": 301,
    "name": "Wonderville Open Hive Night 12/13/2023",
    "scene": 15,
    "scene_name": "nyc",
    "slug": "wonderville-open-hive-night-12132023",
    "date": "2023-12-13",
    "is_active": false,
    "location": "",
    "description": "",
    "allow_registration": false,
    "registration_close_date": null,
    "registration_banner": null,
    "accept_payments": false,
    "link_type": "challonge",
    "registration_message": "",
    "payment_message": "",
    "stripe_configured": false,
    "awards": null,
    "require_player_photo": false,
    "assigned_cabinets": [],
    "tidbit_prompt": "Interesting tidbit about yourself",
    "scene_display_name": "New York"
  },
  {
    "id": 300,
    "name": "Wonderville Open Hive Night 12/6/2023",
    "scene": 15,
    "scene_name": "nyc",
    "slug": "wonderville-open-hive-night-1262023",
    "date": "2023-12-06",
    "is_active": false,
    "location": "",
    "description": "",
    "allow_registration": false,
    "registration_close_date": null,
    "registration_banner": null,
    "accept_payments": false,
    "link_type": "challonge",
    "registration_message": "",
    "payment_message": "",
    "stripe_configured": false,
    "awards": null,
    "require_player_photo": false,
    "assigned_cabinets": [],
    "tidbit_prompt": "Interesting tidbit about yourself",
    "scene_display_name": "New York"
  },
  {
    "id": 297,
    "name": "Wonderville December BYOT",
    "scene": 15,
    "scene_name": "nyc",
    "slug": "wonderville-december-byot-1",
    "date": "2023-12-02",
    "is_active": false,
    "location": "",
    "description": "",
    "allow_registration": false,
    "registration_close_date": null,
    "registration_banner": null,
    "accept_payments": false,
    "link_type": "challonge",
    "registration_message": "",
    "payment_message": "",
    "stripe_configured": false,
    "awards": null,
    "require_player_photo": false,
    "assigned_cabinets": [],
    "tidbit_prompt": "Interesting tidbit about yourself",
    "scene_display_name": "New York"
  },
  {
    "id": 292,
    "name": "Wonderville Open Hive Night 11/29",
    "scene": 15,
    "scene_name": "nyc",
    "slug": "wonderville-open-hive-night-1129",
    "date": "2023-11-22",
    "is_active": false,
    "location": "",
    "description": "",
    "allow_registration": false,
    "registration_close_date": null,
    "registration_banner": null,
    "accept_payments": false,
    "link_type": "challonge",
    "registration_message": "",
    "payment_message": "",
    "stripe_configured": false,
    "awards": null,
    "require_player_photo": false,
    "assigned_cabinets": [],
    "tidbit_prompt": "Interesting tidbit about yourself",
    "scene_display_name": "New York"
  },
  {
    "id": 291,
    "name": "Wonderville Open Hive Night",
    "scene": 15,
    "scene_name": "nyc",
    "slug": "wonderville-open-hive-night-1",
    "date": "2023-11-15",
    "is_active": false,
    "location": "",
    "description": "",
    "allow_registration": false,
    "registration_close_date": null,
    "registration_banner": null,
    "accept_payments": false,
    "link_type": "challonge",
    "registration_message": "",
    "payment_message": "",
    "stripe_configured": false,
    "awards": null,
    "require_player_photo": false,
    "assigned_cabinets": [],
    "tidbit_prompt": "Interesting tidbit about yourself",
    "scene_display_name": "New York"
  },
  {
    "id": 288,
    "name": "Wonderville Open Hive Night",
    "scene": 15,
    "scene_name": "nyc",
    "slug": "wonderville-open-hive-night",
    "date": "2023-11-08",
    "is_active": false,
    "location": "",
    "description": "",
    "allow_registration": false,
    "registration_close_date": null,
    "registration_banner": null,
    "accept_payments": false,
    "link_type": "challonge",
    "registration_message": "",
    "payment_message": "",
    "stripe_configured": false,
    "awards": null,
    "require_player_photo": false,
    "assigned_cabinets": [],
    "tidbit_prompt": "Interesting tidbit about yourself",
    "scene_display_name": "New York"
  },
  {
    "id": 284,
    "name": "Wonderville November 2023 BYOT",
    "scene": 15,
    "scene_name": "nyc",
    "slug": "wonderville-november-2023-byot",
    "date": "2023-11-04",
    "is_active": false,
    "location": "",
    "description": "",
    "allow_registration": false,
    "registration_close_date": null,
    "registration_banner": null,
    "accept_payments": false,
    "link_type": "challonge",
    "registration_message": "",
    "payment_message": "",
    "stripe_configured": false,
    "awards": null,
